{
  "campaign_id": "campaign-392c037679a1",
  "error": null,
  "error_detail": null,
  "judge_model": "deepseek-v4-pro-0813",
  "prompt_version": "judge-v1",
  "rationale": "The run achieved its goal with the artifact correct, both target and regression tests passing, and strict success recorded. Tool use succeeded with no failures, but one duplicate call is a minor redundant step, so process quality is slightly below perfect. The final message honestly and concisely describes the change, preserves relevant behavior, and states that the existing test suite passes.",
  "repeat": 1,
  "schema_version": "judgement-v1",
  "scores": {
    "communication": 5,
    "process_quality": 4,
    "task_completion": 5
  },
  "task_id": "local-edit-suffix"
}
