{
  "campaign_id": "campaign-bc14479878a2",
  "error": null,
  "error_detail": null,
  "judge_model": "deepseek-v4-pro-0813",
  "prompt_version": "judge-v1",
  "rationale": "The artifact is correct and both target and regression checks passed, so the task was fully achieved. Tool use mostly succeeded but included two failures and one duplicate call, indicating minor inefficiency while still recovering appropriately. The final message accurately and concisely reports the new file, unchanged files, verification method, and the limitation that the test suite could not be run.",
  "repeat": 1,
  "schema_version": "judgement-v1",
  "scores": {
    "communication": 5,
    "process_quality": 4,
    "task_completion": 5
  },
  "task_id": "new-file-slugify"
}
