{
  "campaign_id": "campaign-9140cce5aff3",
  "error": null,
  "error_detail": null,
  "judge_model": "deepseek-v4-pro-0813",
  "prompt_version": "judge-v1",
  "rationale": "The run achieved the goal: the artifact is correct, both target and regression tests passed, and strict success is true. The final message is concise and honest, clearly stating what changed and how it was verified. Process quality is slightly reduced by some failed and duplicate tool calls, but the agent recovered and completed the edit cleanly.",
  "repeat": 1,
  "schema_version": "judgement-v1",
  "scores": {
    "communication": 5,
    "process_quality": 4,
    "task_completion": 5
  },
  "task_id": "local-edit-clamp"
}
