{
  "campaign_id": "campaign-f1f83b561e2e",
  "error": null,
  "error_detail": null,
  "judge_model": "deepseek-v4-pro-0813",
  "prompt_version": "judge-v1",
  "rationale": "The run achieved the goal with strict success: only the intended handler was changed, the target and regression tests passed, and no incorrect paths were modified. All four tool calls succeeded without failures or duplicates, indicating an efficient read-edit-verify sequence. The final message honestly and concisely describes the exact change and verification results, including passed tests and untouched files.",
  "repeat": 1,
  "schema_version": "judgement-v1",
  "scores": {
    "communication": 5,
    "process_quality": 5,
    "task_completion": 5
  },
  "task_id": "large-file-handlers"
}
