{
  "campaign_id": "campaign-bc14479878a2",
  "error": null,
  "error_detail": null,
  "judge_model": "deepseek-v4-pro-0813",
  "prompt_version": "judge-v1",
  "rationale": "The artifact is correct and both target and regression tests pass, so the task is fully achieved. Tool use was generally clean with no failures, but one duplicate call prevents a perfect process score. The final message is concise, accurate about behavior and scope, and clearly states the verification command and passing tests.",
  "repeat": 1,
  "schema_version": "judgement-v1",
  "scores": {
    "communication": 5,
    "process_quality": 4,
    "task_completion": 5
  },
  "task_id": "local-edit-suffix"
}
