{
  "campaign_id": "campaign-9140cce5aff3",
  "error": null,
  "error_detail": null,
  "judge_model": "deepseek-v4-pro-0813",
  "prompt_version": "judge-v1",
  "rationale": "The artifact is correct, both oracle target and regression tests pass, and the state is strictly successful. The agent read before editing, recovered to a passing state, and verified with unittest, though some failed and duplicate tool calls suggest minor inefficiency. The final message accurately summarizes the changes and verification.",
  "repeat": 1,
  "schema_version": "judgement-v1",
  "scores": {
    "communication": 5,
    "process_quality": 4,
    "task_completion": 5
  },
  "task_id": "locate-rename-timeout"
}
